[
  {
    "code": "2.N.1",
    "subject": "Matemáticas",
    "grade": "2",
    "domain": "N",
    "expectation": "Reconoce la relación entre los números cardinales hasta cuatro dígitos (0 al 9,999), las cantidades que estos representan y el valor posicional de sus dígitos.",
    "source": "DEPR Estándares de Contenido y Expectativas de Grado — Matemáticas (2022)"
  },
  {
    "code": "2.N.1.1",
    "subject": "Matemáticas",
    "grade": "2",
    "domain": "N",
    "expectation": "Cuenta, lee y escribe números cardinales hasta cuatro dígitos a partir de un número dado.",
    "source": "DEPR Estándares de Contenido y Expectativas de Grado — Matemáticas (2022)"
  },
  {
    "code": "2.N.1.2",
    "subject": "Matemáticas",
    "grade": "2",
    "domain": "N",
    "expectation": "Identifica y representa el número cardinal de cuatro dígitos basándose en el significado de las unidades de millar, centenas, decenas y unidades.",
    "source": "DEPR Estándares de Contenido y Expectativas de Grado — Matemáticas (2022)"
  },
  {
    "code": "2.N.1.3",
    "subject": "Matemáticas",
    "grade": "2",
    "domain": "N",
    "expectation": "Representa la respuesta de ordenar y comparar mediante: ➢ una sucesión o patrón ➢ el uso de los signos de comparación <, >, o =",
    "source": "DEPR Estándares de Contenido y Expectativas de Grado — Matemáticas (2022)"
  },
  {
    "code": "2.N.1.4",
    "subject": "Matemáticas",
    "grade": "2",
    "domain": "N",
    "expectation": "Reconoce e identifica los números pares e impares: ➢ Determina si un conjunto de objetos tiene un número de elementos par o impar. ➢ Reconoce que la suma de dos números pares es par y la suma de dos números impares es par.",
    "source": "DEPR Estándares de Contenido y Expectativas de Grado — Matemáticas (2022)"
  },
  {
    "code": "2.N.1.5",
    "subject": "Matemáticas",
    "grade": "2",
    "domain": "N",
    "expectation": "Aplica el valor posicional de un número cardinal hasta cuatro dígitos para representar unidades de millar, centenas, decenas y unidades. Entiende los siguientes casos especiales: ➢ Se puede decir que 100 es un grupo de diez decenas, llamado una “centena”. ➢ Los números 100, 200, 300, 400, 500, 600, 700, 800, 900 se refieren a una, dos, tres, cuatro, cinco, seis, siete, ocho o nueve centenas (con 0 decenas y 0 unidades).",
    "source": "DEPR Estándares de Contenido y Expectativas de Grado — Matemáticas (2022)"
  },
  {
    "code": "2.N.1.6",
    "subject": "Matemáticas",
    "grade": "2",
    "domain": "N",
    "expectation": "Compone y descompone números cardinales hasta cuatro dígitos. Utiliza la notación desarrollada para representar números cardinales de hasta cuatro dígitos.",
    "source": "DEPR Estándares de Contenido y Expectativas de Grado — Matemáticas (2022)"
  },
  {
    "code": "2.N.1.7",
    "subject": "Matemáticas",
    "grade": "2",
    "domain": "N",
    "expectation": "Nombra y utiliza los números ordinales hasta el vigésimo (20) lugar para resolver problemas matemáticos.",
    "source": "DEPR Estándares de Contenido y Expectativas de Grado — Matemáticas (2022)"
  },
  {
    "code": "2.N.1.8",
    "subject": "Matemáticas",
    "grade": "2",
    "domain": "N",
    "expectation": "El uso de la recta numérica ➢ Representa números cardinales como longitudes con los puntos correspondientes a los números 0, 1, 2,..., ubicados a la misma distancia a partir del 0. Representa sumas y diferencias de números cardinales hasta 100.",
    "source": "DEPR Estándares de Contenido y Expectativas de Grado — Matemáticas (2022)"
  },
  {
    "code": "2.N.2",
    "subject": "Matemáticas",
    "grade": "2",
    "domain": "N",
    "expectation": "Aplica el valor posicional de un número cardinal con base 10 hasta la unidad de millar para realizar operaciones.",
    "source": "DEPR Estándares de Contenido y Expectativas de Grado — Matemáticas (2022)"
  },
  {
    "code": "2.N.2.1",
    "subject": "Matemáticas",
    "grade": "2",
    "domain": "N",
    "expectation": "Suma y resta con números hasta cuatro dígitos utilizando estrategias basadas en el valor posicional, las propiedades de las operaciones y/o la relación entre la suma y la resta: ➢ sin reagrupar y ➢ reagrupando.",
    "source": "DEPR Estándares de Contenido y Expectativas de Grado — Matemáticas (2022)"
  },
  {
    "code": "2.N.2.2",
    "subject": "Matemáticas",
    "grade": "2",
    "domain": "N",
    "expectation": "Utiliza estrategias basadas en el valor posicional y las propiedades de la suma (identidad de la suma (0), conmutativa y asociativa) para realizar sumas de hasta cuatro sumandos.",
    "source": "DEPR Estándares de Contenido y Expectativas de Grado — Matemáticas (2022)"
  },
  {
    "code": "2.N.3",
    "subject": "Matemáticas",
    "grade": "2",
    "domain": "N",
    "expectation": "Identifica, expresa, reconoce, representa y utiliza diferentes representaciones para las fracciones y entiende que una fracción 풏 풅 se construye a partir de n fracciones unitarias de la forma ퟏ 풅.",
    "source": "DEPR Estándares de Contenido y Expectativas de Grado — Matemáticas (2022)"
  },
  {
    "code": "2.N.3.1",
    "subject": "Matemáticas",
    "grade": "2",
    "domain": "N",
    "expectation": "Identifica, reconoce y escribe diferentes representaciones para las fracciones usando materiales concretos y semiconcretos.",
    "source": "DEPR Estándares de Contenido y Expectativas de Grado — Matemáticas (2022)"
  },
  {
    "code": "2.N.3.2",
    "subject": "Matemáticas",
    "grade": "2",
    "domain": "N",
    "expectation": "Representa y compara fracciones como parte de un entero o conjunto usando materiales concretos y semiconcretos.",
    "source": "DEPR Estándares de Contenido y Expectativas de Grado — Matemáticas (2022)"
  },
  {
    "code": "2.N.4",
    "subject": "Matemáticas",
    "grade": "2",
    "domain": "N",
    "expectation": "Representa y resuelve problemas de suma y resta con números cardinales hasta cuatro dígitos.",
    "source": "DEPR Estándares de Contenido y Expectativas de Grado — Matemáticas (2022)"
  },
  {
    "code": "2.N.4.1",
    "subject": "Matemáticas",
    "grade": "2",
    "domain": "N",
    "expectation": "Representa el proceso de suma y resta hasta cuatro dígitos por medio de materiales concretos y representaciones semiconcretas.",
    "source": "DEPR Estándares de Contenido y Expectativas de Grado — Matemáticas (2022)"
  },
  {
    "code": "2.N.4.2",
    "subject": "Matemáticas",
    "grade": "2",
    "domain": "N",
    "expectation": "Utiliza estrategias para resolver ejercicios de suma y resta de cuatro dígitos: ➢ materiales concretos y representación semiconcreta, ➢ estimación, ➢ cálculo mental.",
    "source": "DEPR Estándares de Contenido y Expectativas de Grado — Matemáticas (2022)"
  },
  {
    "code": "2.N.4.3",
    "subject": "Matemáticas",
    "grade": "2",
    "domain": "N",
    "expectation": "Resuelve problemas de suma y resta en situaciones cotidianas: ➢ utiliza la relación inversa entre la suma y la resta para resolver problemas y comprobar resultados, y ➢ expresa la respuesta en forma verbal o numérica.",
    "source": "DEPR Estándares de Contenido y Expectativas de Grado — Matemáticas (2022)"
  },
  {
    "code": "2.N.5",
    "subject": "Matemáticas",
    "grade": "2",
    "domain": "N",
    "expectation": "Comprende e interpreta los arreglos rectangulares como modelos de multiplicación con factores iguales o menores a 5.",
    "source": "DEPR Estándares de Contenido y Expectativas de Grado — Matemáticas (2022)"
  },
  {
    "code": "2.N.5.1",
    "subject": "Matemáticas",
    "grade": "2",
    "domain": "N",
    "expectation": "Utiliza sumas repetidas para representar y determinar el proceso de multiplicar por medio de: ➢ dibujos, ilustraciones, materiales concretos y semiconcretos, ➢ arreglos rectangulares.",
    "source": "DEPR Estándares de Contenido y Expectativas de Grado — Matemáticas (2022)"
  },
  {
    "code": "2.N.6",
    "subject": "Matemáticas",
    "grade": "2",
    "domain": "N",
    "expectation": "Representa la división como la distribución de objetos en grupos iguales utilizando materiales concretos y semiconcretos, e interpreta y utiliza la resta repetida como una división.",
    "source": "DEPR Estándares de Contenido y Expectativas de Grado — Matemáticas (2022)"
  },
  {
    "code": "2.N.6.1",
    "subject": "Matemáticas",
    "grade": "2",
    "domain": "N",
    "expectation": "Representa la división con o sin residuo mediante: ➢ el uso de dibujos e ilustraciones, ➢ el uso de materiales concretos y semiconcretos, ➢ la resta repetida, y ➢ reconoce y distingue entre los símbolos de – y ÷. Álgebra El estudiante es capaz de realizar y representar operaciones numéricas que incluyen relaciones de cantidad, funciones, análisis de cambios, emplea números, variables y signos para resolver problemas matemáticos y de la vida diaria.",
    "source": "DEPR Estándares de Contenido y Expectativas de Grado — Matemáticas (2022)"
  },
  {
    "code": "2.A.7",
    "subject": "Matemáticas",
    "grade": "2",
    "domain": "A",
    "expectation": "Reconoce, lee, describe y amplía patrones repetitivos y crecientes.",
    "source": "DEPR Estándares de Contenido y Expectativas de Grado — Matemáticas (2022)"
  },
  {
    "code": "2.A.7.1",
    "subject": "Matemáticas",
    "grade": "2",
    "domain": "A",
    "expectation": "Reconoce patrones numéricos ➢ Cuenta de 5 en 5, de 10 en 10 y de 100 en 100. ➢ Completa diferentes tablas basadas en una regla para revelar patrones. ➢ Reconoce y describe patrones (ascendentes y descendentes) de su diario vivir. ➢ Amplía y crea patrones (ascendentes y descendentes) de su diario vivir.",
    "source": "DEPR Estándares de Contenido y Expectativas de Grado — Matemáticas (2022)"
  },
  {
    "code": "2.A.8",
    "subject": "Matemáticas",
    "grade": "2",
    "domain": "A",